{
  "schema": 1,
  "id": "CHG-0010",
  "title": "Foot 超链接快捷键恢复 Ctrl+Shift+O",
  "date": "2026-09-24",
  "scope": [
    "Linux",
    "App"
  ],
  "domains": [
    "foot",
    "hyprland"
  ],
  "keywords": [
    "foot",
    "URL",
    "超链接",
    "快捷键",
    "冲突",
    "Obsidian"
  ],
  "supersedes": [
    "CHG-0009"
  ],
  "buildsOn": [
    "CHG-0008"
  ],
  "manual": "foot-url-launch.md",
  "risk": "low",
  "requiresBackup": true,
  "backupPaths": [
    "~/.config/foot/foot.ini"
  ],
  "intent": {
    "summary": "撤销 Super+Shift+O 绑定，Foot 超链接入口恢复为 Ctrl+Shift+O。",
    "outcomes": [
      "Foot 中 Ctrl + Shift + O 进入 URL 模式。",
      "Omarchy 的 Super + Shift + O 继续用于启动/聚焦 Obsidian。",
      "URL 跳转标签可正常打开链接。"
    ]
  },
  "check": {
    "readOnly": true,
    "commands": [
      "grep -n \"^show-urls-launch=\" ~/.config/foot/foot.ini",
      "foot --config=\"$HOME/.config/foot/foot.ini\" --check-config",
      "hyprctl binds | grep -E \"modmask: 65|key: O\""
    ],
    "expected": [
      "show-urls-launch=Control+Shift+o 存在。",
      "没有 show-urls-launch=Super+Shift+o。",
      "配置校验通过。",
      "Hyprland 的 Super + Shift + O 仍绑定 Obsidian。"
    ]
  },
  "apply": {
    "selfContained": true,
    "steps": [
      "备份 foot.ini。",
      "将 show-urls-launch 改回 Control+Shift+o。",
      "确认 Omarchy 的 Super + Shift + O 留给 Obsidian。",
      "校验配置并打开新的 Foot 窗口测试。"
    ],
    "commands": [
      "foot --config=\"$HOME/.config/foot/foot.ini\" --check-config"
    ]
  },
  "adapt": [
    "在 Omarchy 上不要把 show-urls-launch 设置为 Super+Shift+o。",
    "hyprctl binds 可能用 modmask 表示修饰键。",
    "若目标环境其他应用占用 Ctrl+Shift+O，先选择别的组合。"
  ],
  "verify": {
    "commands": [
      "foot --config=\"$HOME/.config/foot/foot.ini\" --check-config"
    ],
    "expected": [
      "配置校验通过。",
      "Ctrl + Shift + O 显示 URL 跳转标签。",
      "Super + Shift + O 不进入 Foot URL 模式。",
      "Omarchy 中 Super + Shift + O 继续触发 Obsidian。"
    ]
  },
  "rollback": {
    "steps": [
      "恢复本机应用该变更前的 foot.ini 备份。",
      "或将 show-urls-launch 改回目标环境原先可用组合。",
      "重新执行 foot --check-config 并打开新窗口确认。"
    ]
  }
}
