{
  "schema": 1,
  "id": "CHG-0005",
  "title": "微信缩放与 Fcitx5 候选词",
  "date": "2026-09-24",
  "scope": [
    "Omarchy"
  ],
  "domains": [
    "hyprland",
    "wechat",
    "fcitx5"
  ],
  "keywords": [
    "微信",
    "WeChat",
    "Weixin",
    "XWayland",
    "Fcitx5",
    "候选词",
    "缩放",
    "HiDPI",
    "Xft.dpi"
  ],
  "supersedes": [],
  "buildsOn": [],
  "manual": "wechat-input-scaling.md",
  "risk": "medium",
  "requiresBackup": true,
  "backupPaths": [
    "~/.local/share/applications/wechat-universal.desktop",
    "~/.config/hypr/hyprland.lua",
    "~/.config/hypr/wechat-fcitx5.lua"
  ],
  "intent": {
    "summary": "让微信在 HiDPI 环境下界面缩放和 Fcitx5 候选词大小同时正常。",
    "outcomes": [
      "微信 UI 缩放匹配当前显示器 scale。",
      "焦点在微信时 Fcitx5 候选词大小正常。",
      "焦点离开微信后，其他 XWayland 程序的候选词不会被错误放大。"
    ]
  },
  "check": {
    "readOnly": true,
    "commands": [
      "pacman -Q wechat-universal-bwrap flatpak-xdg-utils patchelf",
      "command -v wechat-universal",
      "grep -n QT_SCALE_FACTOR ~/.local/share/applications/wechat-universal.desktop",
      "test -f ~/.config/hypr/wechat-fcitx5.lua",
      "hyprctl getoption xwayland:force_zero_scaling"
    ],
    "expected": [
      "wechat-universal 相关包已安装。",
      "启动项包含按当前 scale 计算的 QT_SCALE_FACTOR。",
      "wechat-fcitx5.lua 存在并被 hyprland.lua 加载。",
      "xwayland:force_zero_scaling 为 true。"
    ]
  },
  "apply": {
    "selfContained": true,
    "steps": [
      "备份 hyprland.lua、desktop entry 和 XWayland 资源状态。",
      "安装 wechat-universal-bwrap。",
      "按当前显示器 scale 设置 QT_SCALE_FACTOR。",
      "新建 wechat-fcitx5.lua，监听窗口焦点。",
      "焦点在微信时发布 Xft.dpi=96×scale。",
      "焦点离开微信时恢复 Xft.dpi=96。",
      "在 hyprland.lua 中加载模块并 reload。"
    ],
    "commands": [
      "yay -S --needed wechat-universal-bwrap",
      "hyprctl reload"
    ]
  },
  "adapt": [
    "先用 hyprctl monitors 检查当前显示器 scale。",
    "不要在非 2 倍缩放电脑上照抄 192 或 QT_SCALE_FACTOR=2。",
    "若微信窗口 class 不是 wechat，先用 hyprctl clients 检查。",
    "若已有自定义微信启动方式，先确认不要直接覆盖。"
  ],
  "verify": {
    "commands": [
      "hyprctl configerrors",
      "fcitx5-remote -n"
    ],
    "expected": [
      "无配置错误。",
      "微信窗口大小和字体正常。",
      "焦点在微信时 Xft.dpi=96×当前 scale。",
      "焦点离开微信后 Xft.dpi 恢复为 96。",
      "实际输入 nihao 时候选词大小正常并可上屏。"
    ]
  },
  "rollback": {
    "steps": [
      "恢复 hyprland.lua 和 desktop entry 备份。",
      "移除 require(\"hypr.wechat-fcitx5\")。",
      "删除或禁用 wechat-fcitx5.lua。",
      "将根窗口 Xft.dpi 恢复为正常值。",
      "执行 hyprctl reload 并重启微信。"
    ]
  }
}
