{
  "schema": 1,
  "id": "CHG-0006",
  "title": "Workspace 左右切换不循环",
  "date": "2026-09-24",
  "scope": [
    "Omarchy"
  ],
  "domains": [
    "hyprland",
    "workspace"
  ],
  "keywords": [
    "workspace",
    "工作区",
    "方向键",
    "不循环",
    "no wrap",
    "已有 Workspace"
  ],
  "supersedes": [
    "CHG-0003"
  ],
  "buildsOn": [
    "CHG-0003"
  ],
  "manual": "workspace-navigation.md",
  "risk": "low",
  "requiresBackup": true,
  "backupPaths": [
    "~/.config/hypr/bindings.lua"
  ],
  "intent": {
    "summary": "把 Workspace 左右切换改为只遍历当前显示器上已存在的正 ID Workspace。",
    "outcomes": [
      "Ctrl + Left 到第一个 Workspace 时停止。",
      "Ctrl + Right 到最后一个 Workspace 时停止。",
      "不自动创建新 Workspace。",
      "只在当前显示器的已有正 ID Workspace 中移动。"
    ]
  },
  "check": {
    "readOnly": true,
    "commands": [
      "grep -n focus_adjacent_workspace ~/.config/hypr/bindings.lua"
    ],
    "expected": [
      "存在 focus_adjacent_workspace(delta) 函数。",
      "CTRL + LEFT 和 CTRL + RIGHT 都绑定到该函数。",
      "函数只遍历当前显示器的正 ID、非 special、已存在 Workspace。",
      "第一个 Workspace 左移不跳到最后，最后一个右移不跳到最前。"
    ]
  },
  "apply": {
    "selfContained": true,
    "steps": [
      "备份 bindings.lua。",
      "加入 focus_adjacent_workspace 函数。",
      "将 CTRL + LEFT 和 CTRL + RIGHT 绑定到该函数。",
      "执行 hyprctl reload。"
    ],
    "commands": [
      "hyprctl reload"
    ]
  },
  "adapt": [
    "只处理当前活动 Workspace 所在显示器。",
    "若存在负 ID Workspace，本方案不处理。",
    "若用户希望跨显示器切换，先确认方案。"
  ],
  "verify": {
    "commands": [
      "hyprctl configerrors"
    ],
    "expected": [
      "第一个 Workspace 左移不变。",
      "第一个 Workspace 右移进入下一个已有 Workspace。",
      "最后一个 Workspace 右移不变。",
      "中间 Workspace 左右方向正确。"
    ]
  },
  "rollback": {
    "steps": [
      "恢复本机应用该变更前的 bindings.lua 备份。",
      "或将绑定改回 e-1/e+1。",
      "执行 hyprctl reload。"
    ]
  }
}
